seen,username,id,time,location,votes,star,comment
1,貓の薛定谔,woodstar,2022-10-29 00:53:00,云南,29,40,希望每个人都能意识到，世界上最没有意义的事情就是战争，无论出于何种理由，编出多么冠冕堂皇的借口，最终都是为了下令开战的那个人的利益。如果非要说个意义的话，战争最大的意义就是加速腐朽不堪的一方彻底灭亡，有时候无药可救的不治之症唯有被彻底毁灭才能重生，而战争仅仅是毁灭一切最快的途径。
1,well,172503534,2022-11-10 01:30:36,重庆,9,50,人类和鱼一样，记忆都只有7秒。拍再多的反战片都没用，该打打，该杀杀。
1,matchbox,matchbox,2022-10-29 21:29:34,广东,9,30,视听是好，但全程感觉剧情和人物都没有推进，中间泥坑杀敌后崩溃还挺突兀的，军官谈判戏码不要也可。
1,浦世航,190858450,2022-10-29 05:32:05,江苏,20,20,原作对战争幽默诙谐的讽刺是一点没拍出来，对于战争思考探讨的情节更是删的一点都不剩，7.8分的电影拿8.8分，这叫德不配位。
1,月下劈云笑一声,2125570,2022-11-03 07:48:22,江苏,4,50,建议叫嚣着要发动战争的二货们看看，看看二货们是怎么在真正的战场上尿裤子然后被炸成碎片的。但是，二货们又显然不会看这样的片子……
1,和菜头,hecaitou,2022-11-02 22:02:10,北京,9,30,不理解豆瓣8.7分怎么来的，综向比，和历史上的战争片相比，有什么特别之处？横向比，和《敦刻尔克》《钢锯岭》之类的片子相比，有什么不同之处？那个配乐，服了。
1,小旗,139545479,2022-10-29 12:25:08,北京,10,20,既然叫西线就逃不过和老版的比较，可这一比妥妥就是降维，增加了决策层和谈判团视角看起来视野广了格局高了，但一方面这种战争贩子的咆哮和战争阴谋论在近些年已经屡见不鲜，同时更是失去了保尔普通一兵审视战争的平民视角和他清晰的人物轨迹，此外像靴子到丝巾的改编也是败笔，取消保尔回家这段简直自废武功，而凯特之死设计感过强，最后的15分钟的冲锋也完全是编剧将战争悲剧表面化简单化的处理，这种不可说不投机的剧作改编在收获观众浅层感动的同时却丧失了老版最朴实的冲击力和对战争进一步思考的空间，只能说通过这部战争大片明确看到的是工业技术的进步，以及某种程度上电影灵魂的丧失
1,Devlali Number,120060064,2022-10-31 00:24:00,北京,10,50,9-29德国上映，日子不错，真应该国庆档上院线（想他妈什么呢）。在最后一个时段被妄虚尊严拖回地狱，在最后一个时刻坠入地窖与和平天人永隔，好像只有待他躺在泥泞中永远闭上双眼，平静才终于又一次浮现在他的脸上。上层谈判与好战两个角度，其实说的都是战场上士兵的生命如蝼蚁般，在只言片语间飞速且随意地流逝，请永远记住，无论你赋予一场战争怎样的意义试图将其正当化，都无法掩盖任何怂恿且发动战争者皆是罪人的事实。
1,Sophie  Z,sophie-z,2022-11-11 10:25:49,加拿大,4,50,之前只知道remembrance day是纪念一战，但不知道一战的停火协议是11月11日11点。
1,鲜文青木,2445564,2022-10-30 23:33:15,重庆,26,50,如何让宏大叙事面对虚无的本质，以个体的死亡进行无意义的挣扎，套用所谓正义扭曲人性，暴力胁迫恐惧，信奉强权欺凌弱小，醒一醒，巨龙！
1,IllIlIIIIll,whoseyourfather,2022-10-30 00:45:50,江苏,56,10,改编太多槽多无口，而且在我看来全是画蛇添足，去菁存芜。结尾更是究极离谱，以书里男主死亡前的疲倦劳累，死亡时的平静幸福，对战争的理解，对父辈和上级的失望，很难相信停战前一刻钟他还会因为将军的一句命令，作为战争机器上的一颗螺丝钉去主动杀人，就算必须上战场，还不能慢慢悠悠拖过这15分钟？这种情节根本没必要设计出来。很遗憾未来四十年都不会有一部《西线无战事》的翻拍了。
1,Yangshu,137003896,2022-11-04 06:58:22,意大利,10,50,主角最不像主角的电影，没有无敌的朋友帮扶，没有带领谁，只是麻木地看，麻木地走，当恋战癖将军下达荒唐至极的命令时，他依然麻木地转过身投入战场。战争消耗了一个人对生活与生命的希望，恨敌人，同时也恨自己，在战争中根本就没有什么“英雄”，也没有什么“光荣牺牲”，只有饥饿、疼痛、恐惧、绝望。
1,爱丽丝梦魇,191339783,2022-11-11 22:54:34,重庆,12,50,东边有新鲜事吗
1,中年危机谢腾飞,laiziming,2022-11-06 21:21:26,广东,11,40,没有战斗的画面很美，有战斗的很残酷。大人物的眼中，这些青年都是蝼蚁。还有十五分钟就下班了，年轻人也不知道摸下鱼。《地狱之行》一书也提到过一战里绞肉机一样的战役，为了几百米的战线推进，几十上百万的人在死去。
1,alumiss,alumiss,2022-11-13 10:57:26,智利,13,40,有没有人和我一样，看每一部战争片的时候都在研究怎么才能在战场上合理装死
1,z先森,cocco,2022-11-02 22:19:23,四川,8,40,本片在时下有特别意义，如同在提醒叫嚣战争的人，你们为谁而战？你们为什么而战？上战场的人们只是基于立场不同，哪怕杀死的是和自己一样的人。直到自己倒下，直到部队减员到上峰承受不起。一战结束在11.11，那是火药味的血腥的寒冷的泥泞的，充满对蛋白质的渴望，对床的渴望，对干净床单的渴望，对女人的渴望。一条女人的丝巾，被大伙传着闻，他们意淫着这个姑娘连指甲缝都从不会脏，我敢打赌要在和平年代他们可能都不会正眼看一下这个女人，结尾时这条丝巾接力到对方新兵手里，果然女人是和平安宁的温柔乡。有人计划战争结束后子承父业，有人计划战争结束后做乡警，有人不希望战争结束。“在战争中，政治家提供弹药，富人提供食物，穷人提供孩子。战争结束后，政客们取回剩余的弹药，富人种更多的粮食，穷人寻找孩子的坟墓。”——塞尔维亚谚语
1,许有才,56869243,2022-10-30 01:45:38,北京,4,20,和老版真的没法比，那些被改动的情节真的为了戏剧性而戏剧性，逻辑完全不通，老版有那么多经典的镜头和对话，有成长、有批判、有讽刺、有表达，真是没有对比就没有伤害啊～
1,颍原真吾,139015254,2022-10-30 14:55:50,河南,9,40,给狗扔一块肉，肯定会被叼走。给人一点权力的话，他会变得野蛮。
1,县豪,77550974,2022-11-11 22:44:53,重庆,19,50,如果这都不算好电影，那什么是好电影？希望更多年轻人看到这部电影，记住，我们年轻人不能被政治家、军事家PUA，如果想打仗，他们可以自己上前线。
1,未央歌-dream,2483160,2022-10-30 01:28:54,法国,24,50,最好的战争片都是反战的，年度最佳！
1,野地,128552141,2022-10-30 14:20:01,广东,9,40,配乐让人出戏。但正因为这样，才能让观者从战争这出大戏的荒谬中清醒过来。
1,邵禹升,Sys4863548,2022-10-29 20:24:03,吉林,7,30,又一次的翻拍，依旧平平淡淡。但有两点必须夸赞，最佳音效与最佳摄影。每一个肃静的远景，意味着战争之冷酷。西线无战事，代表的是人心的霸权主义，只不过在战争中用生命来填补欲望，着实可悲！
1,是我刀马旦,185361203,2022-11-01 14:23:50,山东,11,50,电影很棒，不过谁侵略谁反思，我不反思。
1,WIKI魏,wikimedia,2022-11-04 02:22:32,北京,2,40,杀一个人是要被判死刑的，杀几个几十个更是如此，如果杀了几千几万人，那就罪该万死；但如果再多杀些，杀了几十万人呢？当然也该判死刑，但对于有些历史知识的人，这个回答就不太确定了；再进一步，如果杀了几百万人呢？那可以肯定这人不会被判死刑，甚至不会受到法律的惩处，不信看看历史就知道了，那些杀人超过百万的人，好像都被称为伟人和英雄；更进一步，如果这人毁灭了一个世界，杀死了其中的所有生命，那他就成了救世主！（我弟问我为啥不爱看战争片，因为有的战争片比恐怖片恐怖。）
1,王俊俊,57604339,2022-11-02 16:58:25,上海,5,20,画蛇添足，多此一举。
1,The 星星,brokenjade,2022-11-11 16:07:24,黑龙江,1,30,导演挺抓不住重点的
1,蓝影志,coolmovie,2022-10-29 00:26:17,广东,24,50,“他很倒霉，眼看就要到终点了”
1,麻绳,ma-sheng,2022-11-04 22:19:42,北京,4,40,硬核反战教育片，制作精良，场面极度真实，不过没有让人有代入感的故事线，都是场面和情绪的堆砌。为演员们加一星，实在太拼了。
1,颜落寒,yanluohan,2022-10-30 21:41:00,江苏,5,40,战争没有赢家，士死从不“光荣”。政治家们谈不拢的事情，为什么永远是平民士兵在付出生命？
1,一條魚佔滿了河,BlindwolfHyn,2022-11-03 16:56:12,北京,4,50,他們曾是年華正好的少年，愛著那片所生所長的土地，前赴後繼奔赴著戰場，然後，一個接一個倒下成為尸體，鮮血濺到鏡頭上，殘肢斷臂遍地，無人在意，哪有什麼光榮戰死，只有鮮活的生命被剝奪，那片土地的主人並不愛他們，棋盤上的棋子只是棋子，不會血肉模糊，不會呻吟哀嚎，不會活下來了還有戰爭創傷。各個環節都恰到好處，配樂和攝影更是尤為出色，不像《1917》那麼炫技，攪的觀看者萬般情緒，壓抑與殘酷之外，更多是悲傷與憐憫，還有對於戰爭的憤怒與厭惡，而不是對於有人編織出的敵人。
1,理易封,42325900,2022-10-29 21:57:17,辽宁,8,40,导演是想做不一样的尝试，较原著少了好几层维度的探讨，却增加政客视角形成对比，讽刺虚无的尊严，而倒在了和平门口的士兵们，更突出了战争的荒诞。丝巾是悲剧的传承，冲锋是无因的咆哮，那些符号性的东西逐渐形成循环，悲凉而无奈，也许这也是现在再拍这部传世经典的原因之一吧。配乐、摄影很加分
1,胡予矛,huzhuang,2022-10-30 20:55:49,江苏,9,50,跟别处的战争片比起来，此地的就像综艺节目。
1,冰灵风,136970128,2022-10-28 23:16:49,辽宁,10,10,非常不喜欢这一部，过度的美化了战争，导演刻意的回避了战争最为残酷的部分，所有的战争都是人类在为自己的族群挣得一份喘息的空间，一战尤其是如此，导演很巧妙的隐藏了德国军人一旦放弃战争就会让整个族群面临灭顶之灾的事实，通过一个莫名其妙的丝巾极其刻意的放大了整个战争的非正义性。原版电影之所以伟大是因为原版的创作者们在面临战争的非正义性的时候通过电影展现了迷茫与疑问，但是在一百年后的今天，人类已经对两次世界大战都有了巨大的飞跃性的认知，这个片子却仍想通过展现战争的残忍来忽悠一群思维简单的“热血青年”去进行所谓的“反战”，却故意隐瞒了即便没有战争，人类也依然会因为贪婪与傲慢来互相残害的事实。
1,水包酱,43087284,2022-10-28 21:06:02,法国,13,50,对平民而言 从来没有一场好的战争。最可悲的就是我们永远都在让几个人决定几千万人的命运。
1,姨夫李飞鱼,74887580,2022-10-31 20:58:02,北京,4,20,翻新的太勉强了，前作中我认为好的几个片段“截肢战友的靴子”、“休假看到后方对前方的误解和落差”、“拒绝帮老师洗脑下一代”等等，在这一作里全都改掉了，取而代之的是残酷的大场面、画蛇添足的反思，元素多了反而不纯粹了。
1,苗斑,modayuxin,2022-11-03 00:23:12,北京,1,30,7/10 很难不和1930年版比较，148分钟的确有些冗长，直接给出血腥和死亡效果，冲击力是有的，士兵的艰苦和政客的体面之间反差对比也是直接给出，但是保罗的学生时期只保留很小一段，删去了当时德国国内的气氛，虽然有暗示一战导致了二战，但仍感觉反思深度远远不够。战争大场面合格但算不上出彩，感觉不到1930版的迷茫和压抑，结尾更是差距甚远
1,seamouse,seamouse,2022-11-08 10:54:39,云南,8,50,作为也曾跟福煦元帅和埃尔兹贝格一样，曾置身贡比涅森林火车车厢的“游客”，直到刚刚才看完这部新版《西线无战事》。与1930版一样出色，且更想强调政治家手中玩弄士兵的悲剧命运感，而戏剧性地把主要故事搁在终战那几天。反战态度并没1930那样直给，但通过新时代的视听语言，也达成差不多的效果。
1,野地,128552141,2022-10-30 14:20:01,广东,9,40,配乐让人出戏。但正因为这样，才能让观者从战争这出大戏的荒谬中清醒过来。
1,WIKI魏,wikimedia,2022-11-04 02:22:32,北京,2,40,杀一个人是要被判死刑的，杀几个几十个更是如此，如果杀了几千几万人，那就罪该万死；但如果再多杀些，杀了几十万人呢？当然也该判死刑，但对于有些历史知识的人，这个回答就不太确定了；再进一步，如果杀了几百万人呢？那可以肯定这人不会被判死刑，甚至不会受到法律的惩处，不信看看历史就知道了，那些杀人超过百万的人，好像都被称为伟人和英雄；更进一步，如果这人毁灭了一个世界，杀死了其中的所有生命，那他就成了救世主！（我弟问我为啥不爱看战争片，因为有的战争片比恐怖片恐怖。）
1,优游卒岁,2429292,2022-11-08 14:24:04,广东,9,30,影片拍得很精良，尤其是镜头，视野广阔，很有质感，颇有感觉。不过导演也就停留于此，他不是在讲述故事，而是在展示，展示战争的残酷。叙事不流畅，且有气无力，似乎只是为雷马克的小说配上画面。配乐非常奇怪，选择这样的音乐，还不如安静一些更好。
1,PAUL,PaulHao,2022-10-30 01:00:32,陕西,3,50,他们是父亲、孩子、爱人、丈夫，他们是熟识的朋友、陌生的旅人，肩抗步枪的大兵，锡铝箔片的名字，他们背负幸存的责任，他们承担历史的罪孽，他们湛蓝瞳孔中，空洞的，只有燃烬——一如灰色硝烟与红色血雾里，蓝色军服与褐色头盔间，不见光，不见和平鸽。「我们像旅人一样游走在过去的土地。」「我们永远也除不掉这一身臭味。」「我们解脱了。」
1,高詩遠,sunaosquare,2022-11-01 23:35:38,北京,1,20,用大量的經費打造出真實的戰場體驗，音樂與剪輯的配合使戰場上的殘酷披上了一層淒涼的面紗，幾處長拍鏡頭又有「1917」的痕跡。開頭用一件士兵的衣服引出男主，結局又安排一個士兵回收男主的遺物，一代接一代對未來充滿期待的年輕人被送往戰場，構成了一個輪迴的閉環。他們不知道為何而戰，也不理解為何犧牲，能做的只有聽從指令，衝往前線赴死。可這部片子委實沒什麼驚喜，跟同類題材的影片相比無任何突出的地方，基本上大同小異，只是將各種在戰場上會發生的事情拼湊在一塊。用偷東西吃，家人來信，戰友去世，同情敵人等經典橋段拍出了表面的慘烈，但完全看不見人物的弧光。停戰之後根本沒有必要再去偷別人的食物，這種死法只能說設計感過強。
1,麻绳,ma-sheng,2022-11-04 22:19:42,北京,4,40,硬核反战教育片，制作精良，场面极度真实，不过没有让人有代入感的故事线，都是场面和情绪的堆砌。为演员们加一星，实在太拼了。
1,莫听穿林打叶声,DPC18023997802,2022-11-05 00:09:29,广东,7,30,&amp;谭学良我想要说的，前人们都说过了；我想要做的，有钱人都做过了。
1,颜落寒,yanluohan,2022-10-30 21:41:00,江苏,5,40,战争没有赢家，士死从不“光荣”。政治家们谈不拢的事情，为什么永远是平民士兵在付出生命？
1,chcoin,121251305,2022-10-30 08:27:51,江苏,14,10,圣母白左意识形态输出的典型作，反战！反战！反战！战争很恐怖！很恶心！我们要反思！等等……我们的军备不能停，北约的力量还要加强，我们的军舰是维护自由航行的，我们的军事基地要遍布全球，我们的核武器可以毁灭地球一万次，凡是反对我们的，都是邪恶国家！
1,樂天,103622148,2022-11-05 23:56:19,江苏,8,50,双方在堑壕之间的残酷拉锯，战争夺取了无数鲜活的生命，满足的只是衣冠整洁吃着精致食物的那些人的野心和欲望，即便是停火前的几个小时，还要让下面的人去做无谓的牺牲，鲜活的生命，青春的憧憬，还有对家人的思念，都最终破灭在了阴冷潮湿的野地里。1105
1,理易封,42325900,2022-10-29 21:57:17,辽宁,8,40,导演是想做不一样的尝试，较原著少了好几层维度的探讨，却增加政客视角形成对比，讽刺虚无的尊严，而倒在了和平门口的士兵们，更突出了战争的荒诞。丝巾是悲剧的传承，冲锋是无因的咆哮，那些符号性的东西逐渐形成循环，悲凉而无奈，也许这也是现在再拍这部传世经典的原因之一吧。配乐、摄影很加分
1,全息苔藓碎片,156125374,2022-11-12 19:39:48,湖南,8,40,协议商定在11点停战，两个幸存者，一个死在早晨因为偷农户的鹅蛋被射杀，一个因为疯狂的将军死在停战前的一秒钟。妈妈，这就是战争，所有愚蠢或无辜的人都会死于天亮之前。
1,悟臻,Bettercomcn,2022-11-02 01:24:01,广东,8,40,好的电影是会让人谨慎反思的，在普遍都是激情澎湃主旋律的战争片里，需要一些不同视角的电影让我们更加全面的看待问题。
1,原教旨托利党人,2583755,2022-10-29 18:52:42,山东,2,50,"新版西线无战事，刚拖着看了一遍，感觉拍的很精彩，和1930,1979TV版相比，对原著改动很大，原著党就别进了。就新版的精神内核来说，感觉拍的有新意，很震撼，也很到位。死人衣服再回收利用这个真是独具匠心的亮点，战场上充斥的肮脏，腐烂，巨大精神压力，这些因素都拍出来了，塑造的不错。"
1,寂地,zyl622,2022-11-03 22:36:31,云南,5,40,大学晚自习上看完了小说原著，心里堵得要命。下课时走出人群熙熙攘攘的教室。觉得恍若隔世只想大哭一场。看之前没抱什么希望觉得那么多心理描写，漫长又无奈的战壕中的对峙的情节，一定很难拍。但想不到它拍得很好，许多文学化的情节被很艺术展现出来，令人揪心，充满讽刺意味。也许有些情节，如今看会觉得有些老土，但打动过自己的小说，被拍成了令人满意的电影，就是很棒的事情。
1,女神的秋裤,movieater,2022-11-04 12:32:01,山东,3,40,“有餐具吗”之后，神来之笔。战争的惨烈、生命的脆弱、热血的廉价、政治的虚伪，都是在这个美丽的星球上发生的事情。看过最好的战争片之一。
1,海的另一边sin,Hwb1989,2022-11-09 17:24:30,广东,1,30,他们不像战士，只是亲爱的小孩。（说一个巧合：电影中是11月11日停战，而我明后两天军训）
1,tangerine,163153701,2022-11-01 08:13:18,江苏,4,40,我们在这儿，是为了保卫我们的祖国，可法国人在那儿，也是为了保卫他们的祖国，那到底谁是对的？可能我们都是对的。战争的目的对于前线作战的士兵没有直接意义，迟来的和平对于停火前最后一刻牺牲的士兵来说，更像是一个莫大的讽刺，就把这些刻在他的墓碑上吧。时间往前走了一百年，这个世界却仿佛更需要反思，更需要《西线无战事》了。
1,不饿霸,4400048,2022-10-30 21:17:19,上海,5,30,单纯的景观展现，缺戏核，每一趴我都看过，没必要再拎出来说。
1,momo,moudianzhang,2022-10-19 12:21:16,美国,22,50,因为是Netflix的电影所以基本上没有在电影院上映实在是太可惜了，2022年很需要在大屏幕感受战争的残忍和恐怖，战争是折磨着士兵的地狱。
1,bird,yihuiw,2022-10-29 13:05:23,四川,7,40,战争在决策者眼中是远处的一团烟雾，战争也不过是一具具躯体组成。获得奥斯卡的同名电影，至今快100年了，可看看我们今天拍的战争片是什么玩意？虽不及原著和老版本震撼人心，雷马克也永不过时！
1,且听风吟,dingr_1,2022-11-05 14:37:17,广东,14,40,真正好的战争片都是反战的~
1,麒麟,kurillaz123,2022-10-30 01:18:38,北京,6,20,看了半天，弃了。这导演喜欢煽情，有种八十年代浪费时间的无用煽情桥段，特假，特难以带入那种，镜头还特呆板，全是尿点，一边刷手机一边看，不是不认真，是真不吸引人，杀1个敌人，莫名其妙走起内心戏了，我上了个厕所，回来，我靠，还这儿杀呢。。。当年韩剧《大长今》又臭又长，看好几天，就演一个事儿，这个跟大长今有一拼，太墨迹了，真的弃了，浪费时间
1,我爱方便面,49663981,2022-10-30 01:31:03,浙江,4,30,片子一般剧情安排的比较刻意…用这手法拍摄五十年代东亚的那场战争或许给我们的震撼会更大…
1,巴伐利亞酒神,darkwood,2022-10-29 23:57:00,上海,9,50,年度最佳毫无悬念了吧，甚至放在经典战争片中亦能跻身前列。根本就不用从反战角度说事儿，光看那些构图和运镜，就让人拍案叫绝了。每一帧画面都美的不可思议，是真正字面意思上的“血色浪漫”。两次偷东西和肉搏战都看傻了，雪中的森林和并排躺着呻吟是不可错过的名场面。哦对了这开头的5分钟也是近些年看过电影的最佳开场。
1,谋杀游戏机,hexiaoqin,2022-10-31 00:18:03,北京,8,40,熬到终点倒下的人
1,aaron,yuyanjun,2022-11-05 18:47:57,江西,2,30,主题、摄影、美术、配乐都没什么可挑剔的，适合在大荧幕上看，换成电脑小屏幕，没有强情节的剧情对耐心是个很大的考验。
1,Sundance小千,monster1000,2022-10-29 22:39:46,广东,14,40,大佬吃大餐，小兵吃子弹。
1,完颜穆尔登格,krolik,2022-10-29 07:40:25,爱尔兰,1,30,竟然让我看不下去
1,猫阿水,hokey,2022-10-29 22:17:33,北京,8,50,一将功成万骨枯。可以搭配协约国视角的《他们已不再变老》，全方位体验战争的荒谬残酷肮脏丑陋变态恶心泯灭人性。键盘上的战争贩子们从来没有想过，如果真有这么一天，自己也不过是后脖领子上的一片布条。
1,柳三行,lsxfilm,2022-10-31 12:44:03,江苏,6,30,这种大数据创作模式已经黔驴技穷，配乐上模仿《禁闭岛》，摄影上模仿《1917》，结尾模仿《这个杀手不太冷》，故事和人物毫无推进，本片亮点也只剩构图和演员了。大框架和投机取巧的软科幻几乎一模一样，开场气势很足，场面很大，然后一直平缓过渡到电影中段，适当插入刺激场面，继续平缓到结尾，中间插入点骗眼泪的桥段。说无良的战争对不起士兵性命的同时，是否意识到无良的电影对不起演员的敬业？说人类从未在战争中吸取什么教训的同时，是否意识到本身也在创作中重蹈覆辙？那些士兵是无良战争的受害者，观众也同样是无良电影的受害者。
1,奇爱博士,shadanbbi,2022-11-12 19:58:36,北京,4,40,双11不光是单身节和购物日，也是一战终战日。在特殊的日子看这样的电影，也是令人唏嘘感慨，更加希望和平之光永照大地。另外，这种场面宏大、制作精良的电影难道不最应该上大银幕欣赏吗？现在只能上流媒体看下载，也真是白瞎了。可惜。
1,Vivian,45278107,2022-11-08 20:25:11,上海,2,30,那些别有用心的编造各种理由，发动战争的阴谋家都是该下地狱，而且永不超生。当然，如果真的有地狱。
1,深溪虎,Mercury9999,2022-11-04 17:44:02,上海,4,30,静态画面一百分，道具细节八十分，人物刻画六十分，故事内容四十分，节奏深度二十分，总体评价六十分，名著加持十分，这部片子可以打七十分。
1,里中静流,xxzy93,2022-10-29 22:34:10,山东,2,40,这个电影令人心梗。
1,国王KING,problemchildren,2022-11-06 09:58:40,广东,1,30,将一群群耗材送上去，完了之后又到下一批。开场的关键道具「衣服」串起了两场战事，前一场战争的人死去的衣服被扒走，换到了天真、雄心勃勃的年轻人身上。
1,你的益达,51067589,2022-11-05 18:37:55,广东,1,40,中间一些空镜头片段实在太走心了，夹杂背景音乐唐突诡异的金属噪音。文戏过于温吞，我更喜欢老版本。还有一些名场面，例如回学校宣讲战争残酷，在酒吧面对战狼老壁灯，这些没有翻拍太遗憾了。结尾钉在战壕上的画报女郎呼应了1930版的战壕蝴蝶，感受到新世纪不一样的表达。
1,今言,lengshan310,2022-10-29 20:30:27,浙江,9,40,好友情铺垫不够，难以共鸣。末尾冲锋过于牵强，为了惨而惨。
