seen,username,id,time,location,votes,star,comment
1,臻圣,ZhenSheng0419,2022-11-16 22:26:59,北京,1,30,7.4分。这片子评分起码不应该比《沙赞》低。论特效和打斗场面，今年绝对不可错过。我觉得如果可以把正义协会和黑亚当最开始交战的矛盾点交代的再明晰一点效果更好。黑亚当前期顶上“城市捍卫者”头衔确实有些唐突，不过打的是真爽啊，城市景观联想到《X战警：天启》。能感觉到强森很努力的想把黑亚当塑造成一个亦正亦邪的角色，大篇幅去强调他和传统英雄的区别——“杀生”。故事也描述一段跨越千年的“精神救赎”，赋予角色神性以及“天降正义”。纵观DCEU的电影，高潮大战时刻画面都如史诗般的恢宏，这点在钢铁之躯、女侠、正联里面都有浓墨重彩的刻画，希望可以好好保持住这个特色。话说，谁看到片尾的亨超出来不激动呢，这点真心感谢强森，希望DCEU越来越好。
1,Devlali Number,120060064,2022-11-16 23:57:14,北京,1,40,好就好在出现了继扎导系列后DCEU最强的打击感和压倒性的速度，坏就坏在真的很让我担心按照这个叙事水平，接下来与超人的相遇会变成另一部《金刚大战哥斯拉》，离开大银幕，什么都不是的那种。。。与这点比起来，亨利出场时的里夫配乐都不叫事儿了，毕竟《黑亚当》能把亨利带回来就已经是大功一件了。
1,猫小珥,achering,2022-11-17 00:18:26,江苏,2,40,看完就是一个爽字 节奏很快 从头打到尾 只是有点可惜命运博士的史诗级削弱 彩蛋亨超出场不是什么秘密了 未来两人是否能打一架虽然不好说 但是看到亨超回来就很激动了 然后吧其实我更想看原子粉碎者跟闪电侠组个队 这两个逗比放一起肯定有趣急了 另外一个惊喜是POI之后再见肖大锤 但不知道未来她会不会成为伊西斯 同时也期待一下滑板小子变身奥西里斯 最后一个不知道能不能实现的期待——扎导宇宙回来吧！
1,Lazy Designer,lazydesigner,2022-11-17 00:25:20,上海,2,20,剧本弱智得令人发指，编剧这是得了新冠后遗症编出来的剧本和对话？鹰侠/鸟人=二极管就不好好说话の拱火哔，DR. FATE=淡定划水赚零花钱の博士，另外俩小崽子是tm带资进组的吧？中东/中亚版瓦坎达真的没啥吸引力哈，石头哥一板一眼的演绎真的让我以为这是冷笑话吼。你把摩托骑手打到潘达利亚是为啥啊，农民憋一句中文台词迎合大陆农业市场吗？哦对了，如果沙巴克先复活，石头哥还没关进水底，电影是不是能早半个小时结束啊？母子俩角色真尬，实体工具人+剧情解说导游。变声器沙巴克终究变成手撕鬼子（哪儿来的灵感？）亨超勉强加半★。22/11/16
1,渡千年,142603598,2022-11-08 07:54:04,加拿大,2,40,我和我妹在电影院be like：哇这些人的脑子都是一根线的哇
1,听海,64527267,2022-11-17 13:20:09,广东,0,30,命运博士完全可以早一点把黑亚当叫醒
1,大罗,Gu_li,2022-10-23 00:15:45,江苏,4,40,也就是巨石，所以四星，没有巨石，就只值三星了
1,ᑐᑌᑎᕮ,161390736,2022-10-28 00:05:33,山西,4,20,还没彩蛋燃
1,raku,quarkocean,2022-10-22 02:34:14,上海,7,30,动作&gt;剧本 没有差错的爆米花拍法 又因为原型来自古埃及神话 总觉得一股咖喱味.....探索了一些co1onia1话题浅尝则止 顺便感叹一下黑亚当强到无解了吧 皮尔斯·布鲁斯南老帅了 不过最后亨超出场数秒才是全场尖叫声最响的时刻
1,巴喆,jeffersontang,2022-11-16 23:20:11,福建,3,30,真·手撕魔鬼。还是超英类型大爆米花爽片，熟悉的正邪对战那一套，巨石强森秀肌肉摆造型，反正画面全交后期，最后还是美式英雄主义输出全世界。救小孩情节太拖沓，仅有的一点装深沉还是命运博士的强行牺牲，编剧细节差，黑亚当好不容易被PUA哄近监狱又莫名强行暴力出狱拯救世界这又是何苦。。。反正看高密度电脑特效打斗，爽就完了。真想看大超vs黑鸭。6.7
1,个别人,45581073,2022-11-17 05:43:10,意大利,2,20,看了半天根本不知道这帮人到底想搞毛，谁是好人谁是坏人，为啥要这么做。人物塑造也毫无亮点。话说，知道自己做的特效是为屎一样的剧情服务，特效师会不会感到很沮丧？
1,Cardinal,163158607,2022-10-27 04:46:20,意大利,4,20,D+ / 司空见惯的DC系列的优良传统，以牺牲剧情流畅度和推进的合理动机，只为了万年不变的正反派两面性的所谓的深刻。前半段围绕着身份追寻与英雄定义纠结直至房间内搏斗撕毁正义联盟的海报瞬间才有一丝耐人寻味，但所有的冲突和动机都令人费解。因此后半段彻底放弃讨论，生造一个反派并强行唤醒黑亚当草草完成漫威式流水线，既然如此为何不直接拍无脑b级超英血浆片呢？当然唯一成功的一点在于，巨石强森的角色过分契合演员了，魅力拉满。
1,66号公路灰狗,achangel124,2022-10-26 22:29:37,上海,7,40,特效还是不错的，但是子弹时间实在太多，有种审美疲劳，把黑亚当封起来简直多此一举，巨石适合这种角色，不用有演技，也不需要表情，皮尔斯布鲁斯南演技真的太水，只是适合装酷而已，正义协会看起来就是很弱的样子
1,粵語殘片,EvanChouu,2022-10-29 20:40:26,四川,2,30,一般般
1,莫选好片,64192242,2022-11-07 13:44:16,未知,1,20,黑亚当被巫师团赋予神力，又被封印沉睡了5000年。当他被再次唤醒，黑亚当成了现代世界的神。面对陌生的世界，他可以选择破坏，也可以拯救。DC出品的又一部又黑暗又笨重的高成本超英电影，公式剧本，故事很low，基本上随便铺垫一段文戏就开始毁天灭地的大场面，没有任何趣味性。而且黑亚当的能力有点过强了，很像看金刚大战哥斯拉，正义协会成了观战龙套，打得再猛也没有共情和参与感。但007和大超很帅，就这样。
1,国王KING,problemchildren,2022-10-23 09:05:04,广东,0,30,没有什么亮点的 dark hero 起源故事。印象深刻的是有几幕打戏的慢镜像油画一样。最大的惊喜大概就是彩蛋亨超的出现了。
1,拜见冥王,151607980,2022-10-23 15:13:50,北京,5,30,1、力量影射是明显的：作为地方革命势力的黑亚当，作为外来民主势力的正义协会，以及作为当地封建霸主的沙巴克。2、故事走向依旧是右翼家破人亡后转向左翼阵营，愣头青一心想要复仇的执念最终变成守护一方天地的美好愿景。3、对通心粉西部片的致敬，有些鸡肋（没必要），包括太多刻意模仿扎克·施耐德的慢镜头呈现，也显得可有可无。4、故事中规中矩，虽然略显俗套，但经典叙事的框架还是有的。命运博士的牺牲起码圆回来了：捉弄命运，让该发生的发生（鹰侠之死），同时以己救人，比隔壁傻愣愣树一个指头要服众得多。
1,陈囿,xoxonino,2022-11-16 21:47:02,北京,1,30,重金打造
1,脆脆鲨,146014188,2022-11-17 00:07:21,甘肃,2,20,很多打斗镜头都像扎导的油画感。漫威是单人电影先出，每个角色在观众面前混个脸熟之后通过复仇者联盟穿起来，dc每次都是大杂烩，故事讲得还不咋滴。也有关于黑亚当身份的反转有点意思。所以沙赞和黑亚当在同一个宇宙吗？
1,里卡多,northsun,2022-10-29 04:46:50,德国,5,40,周五晚上就要看无脑爽片。DC宇宙终于又出现了一个经典角色，对，说的就是你，命运博士。
1,给你我最亲爱的,Ken_Monster,2022-11-17 11:10:57,江苏,0,30,文化输出真好啊，手撕反派效果拉满，谁看了不得说一句666呢
1,失去梦想的柴犬,193521385,2022-11-07 07:49:45,加拿大,5,20,这个真的是太bvs了：两方正义的一开局不分青红皂白就是往死里打，然后小男孩（可惜不叫Martha）被掳走，两方就组队打第三方，细节元素还有：无限做梦预见未来，被迫牺牲一个，太典了。不过这个起码画面够亮看得清了，然后时不时带些俏皮话，观感要远远远好于bvs，可惜细节吐槽地方还是太多太多了，人家深海里跳进去竟然还能浮上去，还有你为什么不喊啊，atom和cycle俩真的太酱油了，暧昧不足，作用还花里胡哨，不过我认出atom是那个laraJean的男友哈哈哈哈，然后鹰男像个脑残一样真的是，对外唯唯诺诺，对内重拳出击，打又打不过，喷还喷不过，还一副道貌岸然的自诩正义，看的我烦死了，为什么他不去死！哦对了，因为人家….anyway，没啥惊喜只能说，当然如果吐槽来说，那绝对是高级素材，扎斯林估计又破防了
1,刹那。,79381337,2022-11-17 13:06:53,辽宁,0,20,人物真是多啊 但除了最后的大超居然一个也不认识 沙赞跟黑亚当到底有啥关系
1,咆哮的小清新,73374449,2022-11-16 23:01:01,广东,2,20,"这部同样也是会让人生出「超级英雄电影算是到了头了」之感慨的那种片。“死侍”式的冷笑料其实到了死侍2就有点疲了，更别说之后无数超英片都在沿用。然后这部再用，话痨式的密集台词和笑料，无趣无效。特效堆了又堆，开玩笑似的说来就来，审美疲劳且这个特效做得也不好。讲的故事也同质化严重。Again, 这就是可以归入「超级英雄电影算是到了头了」系列的超英片。"
1,小羊不亦乐乎,51888816,2022-11-07 05:50:00,美国,5,20,乏善可陈，探险家见到了传说中的王冠，一副面瘫表情，可怕。什么时候，找个超人客串一下观众就高潮了？廉价但管用，漫改的流量密码找到了，
1,kinder23,47160389,2022-10-23 17:02:22,中国香港,3,20,无法欣赏简单粗暴的情节和人物…
1,西域奇童,vvv2rock,2022-10-26 08:28:12,马来西亚,4,30,好尬啊，这都些啥，jsa的入场也很强行。好莱坞大片里所有混乱的地方都有中东或者东欧元素。有几句金句，说明好莱坞编剧还是有在客观观察这个世界，但不足以支撑整个故事。上周看的，一直忘了mark。没啥值得
1,伪淡定小姐,some_Ji,2022-11-04 17:54:23,新加坡,4,50,我好喜欢啊！！可以，这很漫威。黑亚当和Hawkman的CP真的不嗑吗kswlkswl ᐟ.ᐟJustice Society里的英雄既视感真的很强，猎鹰 奇异博士 蚁人 还有那个风一样的女子头发也太像Brave里Merida了吧每次出场都很迪士尼。黑亚当虽然也是imba但是没有原则的样子真的很可爱哈哈哈哈其实大招有点像锤哥(雾。这部的配乐我也很喜欢，无论是史诗类型还是流行乐。笑点很密，燃点也很多，我有点出乎意料了，黑亚当疯狂上分，更何况还有亨超大甜甜啊啊啊啊啊。#叛变预定
1,西西里的朗读者,171282164,2022-11-16 12:48:40,上海,2,30,不说剧情有多无聊，特效都很假是最近好莱坞通病吗？
1,De,gongdadali,2022-10-24 21:20:49,广东,3,40,复联之后，DC比漫威反而有优势了
1,张大毛喝美年达,45613020,2022-11-07 01:04:59,印度尼西亚,1,40,一部合格偏上的打打杀杀特效电影，因为看到了纳布鹰男还有JSA这个名字，略有激动的加一星。虽然鹰男莫名其妙也变成了黑人，但what's new，我更比较关心鹰女在哪儿。老婆真好，虽然完全不知道在说啥但还是陪我看完了两小时的乒铃乓啷。
1,敛月,1444475,2022-11-02 03:13:37,西班牙,1,30,比想象的好一些，有些小笑点，黑亚当身世有些转折，但整体还是过于套路和说教。超英市场死气沉沉，两边都不太行
1,匣中猫,Psalmoi_Jidai,2022-10-30 16:06:58,中国香港,1,30,感覺幾乎每個角色都可以在隔壁搬出對照組，當然是誰先做出來的這可不好說……但無聊和拖沓程度大概就是我眼睜睜看著前排人時不時就亮屏看手機關注●情新進展而我毫無阻攔他（們）的衝動甚至也想掏出手機關注一下這樣，就也一直在心裡比較《黑豹》會比這片好在哪，後面想清楚，可能是爹味含量沒有這部足吧。總的來說就是用（不足）2個小時塑造了一個霸氣外露的black daddy，然後最後彩蛋讓大超蹦出來讓你自己心裡抉擇要選誰做daddy，那當然我選大超😋。
1,海鸥,170746121,2022-11-17 12:46:01,河北,0,30,复联神仙打架时，连鹰眼这种元老都插不上话，正联和黑亚当混战，双方竟然听一个弱女子讲道理，总感觉有点奇怪！
1,脆脆鲨,146014188,2022-11-17 00:07:21,甘肃,2,20,很多打斗镜头都像扎导的油画感。漫威是单人电影先出，每个角色在观众面前混个脸熟之后通过复仇者联盟穿起来，dc每次都是大杂烩，故事讲得还不咋滴。也有关于黑亚当身份的反转有点意思。所以沙赞和黑亚当在同一个宇宙吗？
1,HolyC,chrisf,2022-11-08 22:46:48,湖北,2,30,阿曼达沃勒宇宙是吧?
1,风之火,149703198,2022-11-16 16:22:15,江苏,3,50,虽然剧情挺烂，但是还是今年最好看的超英之一
1,Logan wayne,Loganandvictor,2022-11-15 20:46:32,黑龙江,1,40,特效很不错，剧情有点无聊
1,失去梦想的柴犬,193521385,2022-11-07 07:49:45,加拿大,5,20,这个真的是太bvs了：两方正义的一开局不分青红皂白就是往死里打，然后小男孩（可惜不叫Martha）被掳走，两方就组队打第三方，细节元素还有：无限做梦预见未来，被迫牺牲一个，太典了。不过这个起码画面够亮看得清了，然后时不时带些俏皮话，观感要远远远好于bvs，可惜细节吐槽地方还是太多太多了，人家深海里跳进去竟然还能浮上去，还有你为什么不喊啊，atom和cycle俩真的太酱油了，暧昧不足，作用还花里胡哨，不过我认出atom是那个laraJean的男友哈哈哈哈，然后鹰男像个脑残一样真的是，对外唯唯诺诺，对内重拳出击，打又打不过，喷还喷不过，还一副道貌岸然的自诩正义，看的我烦死了，为什么他不去死！哦对了，因为人家….anyway，没啥惊喜只能说，当然如果吐槽来说，那绝对是高级素材，扎斯林估计又破防了
1,李湘,leexiang,2022-11-03 21:20:20,湖南,2,40,演员阵容是真的很强大。特效做得也不错。就是总感觉有点不够热血澎湃。人类为啥要跟飘在天空的强森直接打架。以卵击石。
1,囧奔的熊猫,57156775,2022-11-16 23:51:44,江苏,1,40,开始五分钟就把编剧吐槽了八百遍，槽点密集土到掉渣，不过越看越沉浸，灵魂男主是命运博士吧，好爱！正义联盟里面鹰侠也不错。黑亚当有时候还挺可爱。女主和她儿子超级烦人又尬，胖舅舅比较讨喜。
1,刹那。,79381337,2022-11-17 13:06:53,辽宁,0,20,人物真是多啊 但除了最后的大超居然一个也不认识 沙赞跟黑亚当到底有啥关系
1,咆哮的小清新,73374449,2022-11-16 23:01:01,广东,2,20,"这部同样也是会让人生出「超级英雄电影算是到了头了」之感慨的那种片。“死侍”式的冷笑料其实到了死侍2就有点疲了，更别说之后无数超英片都在沿用。然后这部再用，话痨式的密集台词和笑料，无趣无效。特效堆了又堆，开玩笑似的说来就来，审美疲劳且这个特效做得也不好。讲的故事也同质化严重。Again, 这就是可以归入「超级英雄电影算是到了头了」系列的超英片。"
1,小羊不亦乐乎,51888816,2022-11-07 05:50:00,美国,5,20,乏善可陈，探险家见到了传说中的王冠，一副面瘫表情，可怕。什么时候，找个超人客串一下观众就高潮了？廉价但管用，漫改的流量密码找到了，
1,小黄豆,140404443,2022-11-16 14:20:26,上海,2,40,这不比隔壁的好看一万倍？？
1,17,Kooie,2022-11-17 03:57:41,广东,0,30,明说的敌英雄了，还来强灌美式鸡汤；苦大仇深写得那么表面，就硬搞漫威那套；结果就还是个小城故事，可惜
1,神烦爵士,141915787,2022-10-29 00:13:16,广西,2,40,4.0，观感不错，就是有一点，你这个拍法，DC以后BOOS就会越来越离谱越来越变态，最后战力会呈现出一种畸形...一整个不怕氪石的魔法超人...最后拍集合电影，俩超人又当T又当C，其他人划划水，闪电侠负责重开..就比较遗憾的是这种恶魔类的BOOS不应该交给黑正嘛..正协除了命运博士其他人跟魔法八竿子打不着..专业不对口不是送嘛
1,变脸,face_off,2022-11-12 15:47:31,美国,2,30,打打打，布鲁斯南的命运博士反而最吸引我，这种纯特效漫改越看越没啥意思了大概…随着虚拍这些越来越广泛，演员以后是不是只要做表情就行了，而且像岁数大点的也不怕，因为打起来就戴上头盔完全动画片了…
1,kinder23,47160389,2022-10-23 17:02:22,中国香港,3,20,无法欣赏简单粗暴的情节和人物…
1,咸鱼撵死猫,S.Q.X,2022-11-16 22:21:06,黑龙江,0,30,全是特效
1,静静的投资,67876993,2022-10-31 21:33:08,浙江,0,30,小复联4，所以票房也缩水了。
1,四处游荡的Lily,33538142,2022-11-16 20:25:26,北京,0,30,我以为我看的是“黑亚当”，没想到满屏都是“沙赞”，结果都是“超人”啊🤣。别管剧情，这片子就是看特效。我早已不关心“全球上映日期”，就看“全网上线”好了。
1,Merov Mugatu!,merovingianeven,2022-11-17 13:59:38,上海,0,20,猫女说，不杀人还有什么意思？其他真是不行……
1,igrɛkonze,lingyun93,2022-10-30 20:38:42,中国香港,3,20,为了超人去看 我满足了
1,小瓣生🌈,lifeshort,2022-11-16 11:18:00,四川,0,30,神明以规则挑选英雄，凡人凭直觉拯救所爱。沉睡的时间换不来全新的时代，跪着的人类望不到人民的脊背，家园的黄土捏成了男孩的模样，理想的国度不过是另一种玩物。褴褛的生灵背负着富有的矿藏，水下的囚笼关着自由的渴望。废柴和木棍足以对抗地狱的火焰，奴隶的身躯亦可击穿统治的王座。是先除恶还是先呼口号，是先抗敌还是先念咒语，看过亿万种结局、空白便是幸运；原来英雄无需等待、唯有自己破茧。
1,路广重,106663926,2022-11-16 22:13:29,四川,0,30,最帅的技能还得是命运博士啊，想起了土影的技能
1,美环🌈,meihuanjiang,2022-10-22 21:38:52,新加坡,3,50,巨石好帅（尖叫）片尾彩蛋有超人！我还以为亚当的老婆脖子上戴的项链预示着女主是亚当的后代，后来一想全家都死光了哪来的后代……
1,1984频道,47155378,2022-10-21 08:41:31,美国,11,20,拍得好一般，没什么亮点可言，但是表达直给得像一条大横幅！“人民不需要英雄，人民需要自由！”
1,小松,150540117,2022-11-16 22:01:05,广东,1,30,剧情毫无亮点。正义协会，没啥作用。
1,旺仔流奶,63663780,2022-11-16 20:37:41,山东,2,20,一锅拙劣的大乱炖，真几把烂！吵闹的BGM，滥用的慢镜，浮夸的世界观设定和逻辑混乱到连脑筋都不敢轻举妄动一下的脑残剧情简直是煎熬体验。强森和大超这种练得已经有点变态的肌肉憨憨已经快引起生理不适了，DC 他妈的还想安排他们来个对决，绝！这个四肢发达，头脑简单还能在天上乱飞，动不动叫自己“神”的世界已经不适合蝙蝠侠生存了…赶紧学学“噩梦”博士，对标妇联4钢铁侠狂飙一波演技，强行下线吧！好人团都强成这样了，反派得多变态才能勉强打个平手啊？
1,phoenie,phoenie,2022-11-17 01:45:43,辽宁,0,30,剧情有点儿乱
1,拉拉西,30799618,2022-11-11 21:24:56,北京,0,30,英雄不杀人？那二次大战咋赢的？爆米花，特效还行，肌肉鼓鼓的嗖嗖飞，挺带感其实。
1,VincentP,57523661,2022-10-30 02:22:45,美国,0,30,有些慢镜头让人怀疑导演的品味。
1,Xander,dongzhibin453,2022-10-27 22:48:23,广东,4,20,大光球来咯！
1,芬芬达,q164511490,2022-11-16 23:24:01,福建,1,40,有点意思，电影院没上映可惜了
1,cenduruila,141132037,2022-11-02 19:35:03,河北,0,30,漫威的水平。个人觉得好看程度一般，去电影院应该也就是看个特效，感觉剧情挺无聊的
1,DingXiyang,iphonest,2022-11-17 12:01:30,加拿大,0,30,设定和人物还真不错，就是这故事的推进也太套路了，一丁点儿惊喜都不给啊
1,章鱼喵是差分机,emptymalei,2022-11-05 05:34:29,德国,0,30,行
1,熊小叔叔叔,Honeydatou,2022-11-16 14:15:02,江苏,2,20,No.2642 挺没意思的。想整深度，又一直在纠结于正义是否能够杀人。而黑亚当呢，又一直都在杀人，但其实他并没有那么坏，从他复仇完成后，这种怒火就应该熄灭了，但当他醒来后又是一通杀戮。反派太弱了，把他压在椅子上扯他的头时，跟复联的几位联合拽灭霸的手套还真像。最后是沃勒这个人物，凭啥她是超人类的全权代理人啊，超人有啥理由要听她的呢？每次出场都是那一张臭脸。
1,　　　　　　　,165744177,2022-11-15 12:44:25,山东,0,30,超人回归👏
1,风凌羽,darkwindsd,2022-11-01 01:21:26,四川,0,30,没有什么意料之外的东西，可以算是强行洗白了，最有深度的是是皮尔斯布鲁斯南，而且一个有正义联盟的世界里，这个国家被搞了那么多年，正联都装聋作哑？正义协会的来源也没有任何铺垫和交代，看个热闹还是可以，逻辑什么的就别奢求了
1,刘小流,liuxiaoliuer,2022-11-17 04:33:04,四川,2,10,这种电影赶紧消失吧
1,Témérairement,50416640,2022-11-17 00:13:03,上海,0,30,刚吐槽电影能从一开始就整个剧情老套成这样时，几个英雄的华丽美术又让人眼前一亮，但随着第七八十个慢镜头出来，我又累了。太老套了。
1,迈杰小强,williamjb597,2022-11-16 11:34:52,浙江,0,30,音乐很满，一段节奏无止境的循环。片尾彩蛋的时候突然掐掉也是无语了，做个过渡会死嘛。巨石强森的眼神笑死
1,XY㍿,snowandrain,2022-11-16 20:11:05,吉林,0,30,DC，在同一套规则里玩的话，是无法赢过漫威的……
1,肆叁,192866092,2022-11-16 20:45:25,黑龙江,2,40,喜欢黑亚当这种反英雄
1,办公室甜心,kirk1226,2022-11-17 08:31:30,德国,2,20,亨超一面我整个少女尖叫
1,少数豪,51665133,2022-11-17 13:27:59,北京,0,20,这种电影不应该在2022年再出现了
1,小明,chuxuemu,2022-11-16 19:39:01,上海,2,20,文戏可太难看了。
1,张咏轩Wayne®,55617091,2022-11-16 14:40:55,内蒙古,5,10,二倍速看还觉得臭长，华纳这几年没啥硬货
1,春猪,ckjoyfnbamarvel,2022-10-23 04:21:42,英国,8,10,介似嘛
1,Infinitezoe,haohaojz,2022-11-12 01:11:09,海南,0,30,亨超回归了！
1,维生素,wssynssm,2022-11-17 03:15:59,重庆,1,20,什么狗屁正义协会，神搓搓的跑到人家里打架，毁了人家的古雕塑，当地人居然没有向他们扔鸡蛋。
1,Mario,SuperMariooo,2022-10-31 07:11:06,内蒙古,2,50,有些人并非刻意去当英雄，但事实是，没有多少人有能力当英雄，而有能力当英雄的，又未必愿意承担这份责任。所以当世界需要英雄，你，你们在哪里？（建议看枪版，建议直接快进到一小时54分处，等待惊喜）生活不能快进，但是电影可以
1,thefinNga,189309984,2022-11-16 16:07:37,山东,0,30,特效有点满 
1,Seungwu,80049248,2022-11-17 03:35:53,英国,0,30,要寿司漫威？
1,摩羯座的猫,bjmiss,2022-11-17 13:36:53,北京,0,50,爆米花该有的都有了，试听开心了。
1,李若水,LiRuoShui,2022-10-30 16:32:14,江苏,1,40,终于有点模样了
1,Hanson Tang,hansontang,2022-10-20 14:34:52,中国香港,4,30,[2022.10.20 @IS激光IMAX] 標準爆米花，毫無新意
1,Parity,191096149,2022-11-09 16:25:35,瑞士,1,30,3++剧本是老套的但同时也是节奏稳健的。开篇充分利用黑亚当的穿越使同一个地域的两个时代发生交互，西方资本的掌控就像奴隶时代的王朝统治，而黑亚当代表的本地民众的反抗情绪呼之欲出。中段黑亚当与JSA的冲突到和解过程填充了相当好看的高密度动作戏与幽默梗。高潮与尾声又通过对JSA的集中刻画做了长时间铺垫，应主旋律超英类型要求巧妙地将反派身份不知不觉中换置以避免触及世界秩序，同时完成一个英雄的最终成长。黑亚当角色成立，初始的人物动机作为了悬念，揭晓之时观众才开始进入第一主角的内心未免有些晚，但也正是这样的悬念设置完成了后期其从反英雄到主流英雄的平稳过渡。而JSA的成员则普遍塑造乏力。总得来说是不容错过的大银幕爽片，严肃叙事与插科打诨不打架，处理得当但过于保守
1,dreamboat,chanelv,2022-10-27 19:25:17,四川,1,30,粗暴简单的动作片布鲁斯南太帅了！！！
1,丰子余,waterfire,2022-11-17 09:01:58,上海,1,20,黑亚当除了长的黑，多么伟光正啊
1,熊能能脚不沾地,newbear,2022-11-17 05:45:21,美国,0,30,原来这就是为爱哐哐穿大墙～
1,王隐情,ywanggmu,2022-10-27 13:34:48,美国,3,50,这比漫威香太多了
1,银河少年Bill,145510274,2022-10-29 21:26:42,新加坡,7,10,2022年看过，或许是这辈子目前看过最荒谬最无语的超级英雄电影……
