seen,username,id,time,location,votes,star,comment
1,拔剑四顾心茫然,45008619,2022-07-17 20:01:06,,9,40,超能双生姐妹花，毁天灭地找亲妈，螳螂黄雀逐个杀，谁是最后大赢家？整体结构和上一部差不多，装逼气质依旧，扭扭脖子，微微一笑，用最蹩脚的中文，说最狠的话，打戏完全升级，烟火大会广告牌上的打戏不比漫威燃多了？这一部导演学会组CP了，黄毛小哥和嘴硬大姐头在一起莫名有爱，超能妹妹和弟弟在一起规划吃货未来的时候好浪漫，谁要看你们打来打去啊？用一堆破铜烂铁组成个撒浪嘿不好吗？假想：烟火大会时突如其来的枪声吓的弟弟往妹妹怀里躲，妹妹舍命相救，甜宠满点，并且收获零食大礼包，边吃边害羞，天哪磕到了磕到了！其实所有的超能动作片，核心都是怪力乱神，在观看预告片的时候已经对类型有所期待，但核心看点并不仅仅是呈现暴力奇观，而是“神”在与人相处的过程中，人性弧光的闪现，看魔女谈恋爱比打架更有反差。魔女开吃播真的有搞头啊喂！
1,龙痴影醉,ADmoviemtime,2022-07-24 19:52:53,,0,,这电影网上看了看别人的几分钟讲解，大致也了解剧情和动作场面，动作场面实在是太夸张了，比超人更超人（超人和旺达都没她厉害），很多时候都是用“意念”在打斗，不得不说这个升级没法认同，加上口碑一般，看了讲解权当看过了。这部讲妹妹，第一部讲姐姐，第三部二姐妹去找妈妈了，希望导演对动作场面能够搞得不要太夸张了，还是得有些可以理解的逻辑。
1,秀山鲤鱼,128265644,2022-07-21 21:58:20,,1,30,6.5分，支线过多影响了主线的拓展，第二集了世界观还没完整架构后面hold不住的概率很大。
1,Keith Lee,68418498,2022-07-16 18:42:44,,5,10,第一部就勉勉强强，第二部完全是烂上加烂...
1,逸宸,aurden,2022-07-16 19:08:09,,3,20,魔女双生花的故事，片名The Other One说的很明确了，只是这个故事太流水账太稀碎，三条人物线编排的很乱很差，至于说着“普通话”的那群人既然说的这么烂，那请以后还是别说了。看演职员表才知道导演和编剧是一个人，作为编剧大概是想不到什么新花招了，只能把改造人写成变种人了，比魔幻更加魔幻，作为导演全片的节奏感、重点都把握不到位，哎西八，白瞎人这么期待~
1,木柵永樂町,35778815,2022-07-04 20:48:09,,12,30,髒話一籮筐🤣😷… 整體 有點懷念[魔女1] 多美x宇植😭…（ TW院線2022/07/01上映，《魔女二部曲：另一個她》，車庫娛樂發行…
1,沙加之伦,misi0912,2022-07-24 14:39:46,,0,30,超能，绝对力量什么的，在这里面也很作弊啊作弊。
1,阿默沫,MonicaSXY,2022-07-17 15:28:05,,1,30,这他母亲的要拍个系列了啊，干脆整剧版得了。
1,呆╮(╯▽╰)╭,mpwin,2022-10-03 18:01:41,北京,0,50,个人觉得很过瘾 期待3
1,臻圣,ZhenSheng0419,2022-08-11 23:35:08,,0,30,6.0分。唯一优于前作一点就是少了很多废文戏，可惜模式上并无突破，全片看完没什么精彩记忆点。
1,乍暖,134002125,2022-07-23 23:44:27,,0,20,5/10。为快进而拍的电影，因为你快进了几次还是一样的无效画面。韩国人自己的超英片，这点还是值得我们学习的，眼红漫威dc就自己来拍别逼逼。铺垫又臭又长，几次大战可看。最吓到我的是李钟硕，曾经的韩剧欧巴也发腮了（看到评论区说像四叔也太损了哈哈哈）。
1,超cute侠,3403686,2022-07-19 22:52:37,,1,20,X战警见了魔女都能给跪了，整个电影最大的盼头就是看她展示超能力，所以只有最后的动作戏能看，两帮人马追击超能魔女的故事线被讲得乱七八糟，而且每场戏都不简洁，尤其上海实验帮在车里那裹脚布般的台词看得人如坐针毡如鲠在喉如芒刺背，酷飒姐和基友下属出场很厉害，真上场就是战五渣，竟然还好意思出演彩蛋，李钟硕我就不说了。
1,红皇后,yican,2022-08-15 10:22:10,,0,20,第二部似乎整个都在铺陈一场大戏，奈何头绪太多，却又迟迟入不了戏，说起来也是137分钟的时长，可是似乎啥也没讲，很多镜头让人想起生化危机，动作画面酷炫却缺乏质感，一切似乎都在向流水线化方向发展，虽然是系列电影，还是要让人看清楚来龙去脉并能独自成立的。
1,听海,64527267,2022-07-17 10:18:41,,7,20,超人女主毫无前作女主的气势，凡人女二更是让人讨厌，对流氓唯唯诺诺，对恩人恶语出击，毫无前作凡人女二的包容理解。而且剧情线分支太多，情节凌乱，各个势力关系模糊，打斗也没有前作的爽快感
1,Vivian,45278107,2022-10-13 21:49:52,上海,0,20,中文讲的很好，下次可别在讲了，求求了！爽片还要什么逻辑，非得抻着拍续集扣你一颗星
1,木偶,1333942,2022-07-29 10:02:22,,0,20,出奇的无聊，把第一部又复制了一遍
1,希锐亚,xxxcjr,2022-07-23 17:46:22,,1,40,整体很无聊，看得昏昏欲睡。但是广告牌上那场战斗可以为此片增加一两星，太爽了。
1,虚空尽无,3938389,2022-07-17 00:00:12,,1,,韩国电影努力原声说华语虽然有点好笑，但是不得不佩服有够敬业
1,O型血,UloveWo,2022-07-28 20:27:14,,0,30,沃尔沃撞击奥迪。韩国演员中文说的不怎么样呀。复原速度太快了。新面孔很多呀，一个都不认识。完全不是一个等级的，碾压吊打。应该还有续集，看结尾留好铺垫了。
1,啊酷呐，吗嗒嗒,November_Rain,2022-07-30 23:28:36,,0,30,这……确定不是漫威的？
1,三疊紀,224504556,2022-09-11 22:15:10,西班牙,0,30,本來以為是超暴力動作爽片，沒想到塞了那麽多的文戲進去，兩個多小時看得太拖沓了，金多美也只客串了最後幾分鐘看不過癮，整體節奏比起第一部差太多了，期待一下第三部兩姐妹聯手殺人
1,琧婯,cloudlandlord,2022-08-03 21:46:36,,0,30,比1差远了，没有了气质，沦为特效片，太失望了，战斗力严重超标，这后面没法拍了
1,沉默的同桌,bigmiao,2022-07-22 18:09:21,,0,20,没有第一部好看，虽然第一部也不咋地。
1,拔剑四顾心茫然,45008619,2022-07-17 20:01:06,,9,40,超能双生姐妹花，毁天灭地找亲妈，螳螂黄雀逐个杀，谁是最后大赢家？整体结构和上一部差不多，装逼气质依旧，扭扭脖子，微微一笑，用最蹩脚的中文，说最狠的话，打戏完全升级，烟火大会广告牌上的打戏不比漫威燃多了？这一部导演学会组CP了，黄毛小哥和嘴硬大姐头在一起莫名有爱，超能妹妹和弟弟在一起规划吃货未来的时候好浪漫，谁要看你们打来打去啊？用一堆破铜烂铁组成个撒浪嘿不好吗？假想：烟火大会时突如其来的枪声吓的弟弟往妹妹怀里躲，妹妹舍命相救，甜宠满点，并且收获零食大礼包，边吃边害羞，天哪磕到了磕到了！其实所有的超能动作片，核心都是怪力乱神，在观看预告片的时候已经对类型有所期待，但核心看点并不仅仅是呈现暴力奇观，而是“神”在与人相处的过程中，人性弧光的闪现，看魔女谈恋爱比打架更有反差。魔女开吃播真的有搞头啊喂！
1,天凉气清,156675491,2022-07-26 17:23:29,,0,30,用最稚嫩的面孔干最狠的事\李钟硕出场好少啊\中文不会讲可以不用讲：）\有些电影拍一部见好就收的\为金多美加一颗星星
1,人形大叔正太心,kenyoo,2022-08-01 21:50:10,,0,30,西巴变成韩国超英片了……女主和四人组的差距等同四人组和凡人的差距，总之太强了
1,鱼川,9082007,2022-07-17 17:35:30,,3,30,期待崔宇植满血复活……
1,局外人,145119364,2022-08-10 06:27:11,,0,30,小姐姐虐菜的核心看点还是不错的。难以接受的是原女主人设大崩啊，从亦正亦邪变成彻彻底底的反派了…PS.李钟硕和原女主的发型是什么鬼，也太难看了吧。PSS.中文我觉得还好耶，起码能听懂。听过太多即使看字幕也听不出来的外片中文了…
1,ArS,ArtShadow,2022-07-27 15:04:02,,0,20,整个一前传的低配版，特效失真到有些魔性。装中国人然后戴口罩是在内涵些什么嘛？还有球球你们不要讲中文了啊！！
1,zj@99,58487709,2022-10-10 20:06:48,,0,20,2022年10月10日，3.8万人在豆瓣标记看过。魔女1的剧情早忘了，这部看的稀里糊涂轮七八糟。主角反正就是和超人以及美国队长打都不会败的超生物。不推荐观看。
1,希锐亚,xxxcjr,2022-07-23 17:46:22,,1,40,整体很无聊，看得昏昏欲睡。但是广告牌上那场战斗可以为此片增加一两星，太爽了。
1,Rex,King-master,2022-07-15 15:27:18,,17,20,抛开更换女主不提，相比第一部的主动复仇，第二部的被动逃亡逊色不少，加上中间一段尴尬老套的感情戏来铺垫女主最后的爆发，实在乏善可陈；血腥打斗仍是看点之一，但武力值相比第一部有明显的膨胀。好歹最后金多美的出场把两部联系在了一起，不知道后续还能否拍好
1,浮生若梦,nodane,2022-09-09 00:17:22,加拿大,0,20,第二部比第一部唯一进步的地方就在于女主申诗雅比金多美好看。
1,无花可说,50178831,2022-07-16 15:10:38,,9,20,很难相信这是同一个导演的作品 节奏稀碎无意义的镜头又多又长 无聊对白 开车走路 活活拖成2小时 感情戏又做作又尴尬 女主更是呆板生硬 一个表情从头演到尾 结局直接开大 别人完全没得玩 果然前面越装逼的人后面死得越快以及麻烦下次你们装日本人吧 那烫嘴的中国话听着真头大
1,那谁家那小谁,monica_ning,2022-07-15 21:35:21,,8,30,续作果然达咩🙅🏻‍♂️，137min的电影看到86min的时候都没捋清楚故事线。情节叙述分散、支线（可能是安插资源咖）太多，动作场面特效竟然意外的假，超能力者们的语言能力也太差了（英文中文的表达蹩脚到令人发指）。
1,夜神月的猫,54998502,2022-07-17 02:04:51,,1,40,这大概就是龙卷给琦玉生个神仙吧！可以！【吃瓜】PS: 文戏节奏慢就算了，后面爽到了，但那中文给劳资尬的鸭，西巴，找个配音那么难吗？！
1,Keith Lee,68418498,2022-07-16 18:42:44,,5,10,第一部就勉勉强强，第二部完全是烂上加烂...
1,xiangkaiad,xiangkaiad,2022-07-16 19:04:29,,2,20,之所以较差是和第一部对比，本以为应该会更好撒，结果前期铺垫一大堆，什么上海、全球特异人，等等，真无聊，大boss不用动，挥挥手抬抬腿，坏人嗖嗖的飞！什么破玩意？！故差评2星！
1,不姨妈的大白色,56492985,2022-07-16 22:30:50,,0,20,阿尼…这个真的有必要拍成系列片么…
1,小小斌,50472495,2022-07-19 09:44:59,,0,30,这《龙珠》加《火影》加《超人》的打斗真的有点太过了，而且个个都是金刚狼，被刀捅，被枪击，被断肢，过一会就恢复，这还打个屁。剧情即普通又混乱，阵营关系交代不清，是敌是友就是一顿干。
1,老珂,4529884,2022-07-20 17:49:13,,1,20,这个剧本真是……一言难尽。
1,yo,yo911217,2022-07-24 15:32:34,,0,20,故事都没讲明白……
1,貓の薛定谔,woodstar,2022-07-16 01:56:25,,4,30,前半段太拖沓，动作戏也浮夸的很，一群韩国人非得讲大段大段尬出天际的中文也是醉了，不过整体观感还是要比第一部稍好一点
1,英年早睡,140404503,2022-07-24 09:33:19,,1,30,1的女主用爽爆的肉搏片打下的IP，2的女主完全没有任何体术来承继。。。这点就很不爽，你好歹练一下然后安排一点肉搏戏给她啊，总感觉她捡了个便宜一样！身体搏斗都交给了那几个上海来的。。。然后队长那两个的战力相差那么悬殊怎么会被派去暗杀女主的？？1的女主最后出现感觉她能力应该有进化了吧，虽然2拍得一般般，但多方势力引入貌似让背景宏大，还是期待一下3会怎样吧~
1,点击即刻爆炸,78065496,2022-07-15 23:10:26,,7,30,还是第一部好看。听到那普通话我差点没绷住。
1,大隐隐于市,chenjisoler,2022-07-21 15:58:24,,0,20,碾压式的打斗毫无意义，跟第一部一个模子刻出来的!中间夹杂的大段中文对白是怎么回事？不是说有中国元素不好，而是中文对白太尴尬了!有几段不看字幕都听不懂他们在说啥! 更重要的是不知道这中文对白有什么意义？画蛇添足! 
1,葱葱,lyh198553,2022-08-11 20:55:05,,0,20,别拍续集了吧
1,龙王良马,1724018,2022-10-02 23:35:55,浙江,0,20,狗尾续貂吧……人物都讲的不清楚，太乱了。
1,zzfznp,zzfznp,2022-07-24 20:09:27,,0,30,一拳超女，现在看这个设定和《黑袍纠察队》的用v药物制造超人类一样。剧情不如第一部的反转有趣，走一个低调装逼路线。每一个桥段导演都在伏笔告诉观众：大家注意，我准备要开始装逼了。
1,红色清凉油,79851899,2022-07-25 16:45:29,,1,,第一部惊艳的是魔女的打斗戏，开创了一种火云邪神式的碾轧打法，第二部不说这个剧情了，五官都没办法演这个打法。
1,当当当当,dangguichenp,2022-07-16 18:20:07,,0,20,策马奔腾目瞪口呆。
1,左眼看电影,nicdone,2022-07-16 09:47:03,,5,30,第一部那么惊艳的动作戏到续集变成魔幻了，从基因改造战士变成超英
1,forfaen,fengruomu,2022-08-08 12:20:15,,0,20,这文戏也太差了，最后十分钟确实好看
1,Raphael C,angelraphael7,2022-08-10 16:01:54,,0,20,比第一部还烂！超能力还有丧尸 都是丑国玩剩下的 这也叫文化输出？没新意！ 那些“上海”来的人说的蹩脚中文 尬出天际！
1,一壶好酒配热粥,159046019,2022-07-27 22:51:46,,0,30,故事线过多导致前半段磨磨唧唧，犯了与前作相同的节奏拖沓问题，然而到最后也没理清主线，显得十分混乱，摆明是为了系列一下部在做废话连篇的人物介绍。电影后半段的打斗足够暴力血腥，但改造上升到念力层面的神仙打架也过于扯蛋了，而且整来一个普通话都说不清的上海团伙瞬间让人出戏，好在金多美的回归与李钟硕退伍后的首次亮相还是加分不少~
1,我的婚前生活,Chuck0924,2022-07-23 01:30:36,,0,20,动不动就能秒天秒地却甘心窝在这儿打打杀杀的反派们真没啥追求啊
1,河童（Ojas）,FEL_Murasakiiro,2022-07-16 21:55:53,,1,30,开头的巴士案子看到又想复习长洱的犯罪心理了以及想起迷失（看到绑她们只是为了试验而不是煤窑和其他竟然觉得安心了那些人也没那么坏甚至女主竟然喜提超能力而不是（）一定是阴间现实看多了的黑化反应和其他）。剧情真无聊。刚觉得女主和普通人姐姐的CP好好磕，结果姐姐便当了。弟弟聊天还不忘PUA女主不温柔这确实很韩国。她几次放过混混（农场被女主暴打后崩溃那里他演得真假啊，这演技怎么选上的），结果混混毫不犹豫的枪杀了她，也是相当真实。以及，学不好中文就不要硬讲，太难听了，还想特意学一些“年轻人”说的话，是看了什么奇奇怪怪某点文么“刁都不刁”这种简直是十年前土狗网文风（还真遇到的就是这样讲的“年轻人”）。看完这个决定不补1了
1,画下天籁,QiuXiao,2022-08-08 04:23:58,,0,20,计划今年6月左右开拍的电影，没想到遭遇了疫情。都不知道什么时候能看了。｜220808看了这部电影，拍的单拎的一条妹妹的故事线。全程几乎都是夸张特效，没有强动作强故事逻辑，有第一部在前，这部就很让人失望了。
1,咯咯精,gegejing,2022-09-12 20:42:25,江苏,0,,动作速度impressive 当感觉概念的意思到了 还是得调试一下
1,The_Mars,themarzz,2022-08-01 03:04:11,,0,30,特效爽片，带着失足少女回家招凶灾
1,陈哈,weiwu,2022-07-16 13:21:22,,2,30,稀碎，拖拉，冗长。
1,壞壞噠貓先森,51990644,2022-07-22 22:26:17,,0,10,导演实在是有太多的恶趣味了，天马行空的超能力、血浆断肢齐飞，看这怪力乱神给混搭的。演员的表演也是灾难级别的。
1,Ove,Ove07,2022-09-24 21:43:17,黑龙江,0,20,看过1，感觉2是方方面面的差，人物剧情动作都不太行感觉很敷衍。妹妹第二部强的离谱，眼神就秒天秒地了。不太行，有点失望。
1,世纪症候群,2723833,2022-07-22 23:19:31,,0,30,反正也分不清谁是谁，长得都差不多。但是这种实力上的差距太大了，简直就是碾压，能不能搞点势均力敌的，虽然打得还行。
1,Big猫不食鱼,3022833,2022-07-15 14:59:44,,3,,拍飞了！
1,水蓝色眼泪💧,chenning3288,2022-08-04 11:18:47,,1,30,豆瓣太走极端了，非黑即白呀。第一部整体远没有7.7分那么好，这第二部也没那么差。特效动作戏全面升级，尺度也不小，最后的超能混战量大给的多，拍的很有观赏性。但是这主故事讲的确实稀碎不清，出场人物过多过杂，对白啰嗦无趣，就让人很想快进。肯定会有第三部，希望能狠狠地做减法，把故事拍的更加单纯简洁一些，不要什么思想内涵，就怎么爽怎么拍就得了，特效动作戏不要减哟。
1,夜子1104,xiaoyezi1104,2022-07-16 20:49:20,,0,30,有点帅唉，要是不说中文就好了，有点尬😂
1,┢落┦,14163854,2022-07-16 14:16:17,,1,30,描写新人物，拓展宇宙，作为铺路型的IP续作，相当合格了。最后一场大决战，可真是大干特干。
1,ZacharyYuan,183598433,2022-07-18 23:57:02,,0,40,比第一部场面更多更大，把人当抹布一样乱扔也太爽了吧。
1,邵禹升,Sys4863548,2022-07-21 10:35:06,,0,10,这是啥呀，比第一部还烂。昏昏欲睡，毫无逻辑，狗屁不通！还2个多小时。
1,一口一个小饼干,71586138,2022-07-31 21:21:27,,0,30,看到最后我发现我脸盲……所以胡子和他的老大没死，然后魔女姐妹带走了那对姐弟对吗
1,莎翁笔下的精灵,49146355,2022-08-01 11:48:39,,1,30,比起第一集，这集更像是终回的序曲。比起姐姐，妹妹就像是克隆出来的增强版，“人味”基本没有了，编剧好像也无意去体现，像姐姐角色那般有个转折，妹妹的出现就是为表现不科学的暴力力量而存在的，角色塑造基本没有考虑。
1,浅仁,Y-Joyce,2022-08-29 13:56:04,,0,30,没看过第一部，直接看的第二部，剧情确实看得云里雾里。从开头部分就超乎想象的血腥，全程都很血腥，实在不适合吃饭的时候看...
1,朝阳区陆依萍,50060410,2022-07-16 15:01:15,,1,20,整个就无语ju了～
1,憨兔兔,1143676,2022-07-15 15:17:45,,0,,比第一部立意还差好多。纯粹超能力动作片么。。。没劲了
1,信电影得永生,38897761,2022-07-26 18:46:13,,0,20,套路化创作本身没问题，但是剧情太拖沓，本来各路神仙打架，以为会有趣很多，到头来，似乎只有那几场动作戏还行。第一部的毛病第二部继续发扬光大了。二星
1,影伴随行,lvmovie,2022-07-21 01:04:17,,0,30,不如第一步不管剧情还是动作特效！
1,大白汐,65313383,2022-07-20 16:29:09,,0,20,怎么做到在第一部铺垫的还可以的情况下让第二部这么无聊的。韩国人民流行装逼式表演，日本人民流行嘶吼式表演。还有那个一言难尽中文配音啊...我严重警告你们，这已经可以上升到辱华的程度了。
1,吴大猫,callmeblack,2022-07-16 13:22:30,,2,30,打得更魔幻了，人人都是装逼犯
1,生活在别处,51770206,2022-09-03 20:49:24,,0,30,6/10.文戏不值一提，但打戏超爽，可惜打戏太短。女主角的功力就像是超人加万磁王加X教授再加闪电侠最后乘10，简直就是神仙一般的存在，和其他角色根本不是一个量纲，就像歌者对地球，还打个屁啊。看结尾应该还有第三集。
1,战斗少女,143500900,2022-07-16 16:22:01,,0,30,完全失去了第一部的惊艳感，二代魔女只有金手指超能力的感觉
1,辛子,173347906,2022-07-17 20:38:20,,0,20,脸盲 再加上发型啥都一样 一直以为是第一季的女主 看到最后 才知道 不是把第一季重新演了一遍
1,千山鸟飞,49372515,2022-08-14 00:01:51,,0,20,没有第一部好看，还有下一部？？
1,Feixiang,feixianggod,2022-07-17 17:31:34,,0,30,复刻首部的承上启下，从申诗雅的选角便可知晓。此次无敌人设的高光，就像是李钟硕全程装逼却只等下一部般的失去意义。爽度虽顶满，却是徒有劲道而无章法的顶满，只能期待第三部力挽狂澜了。
1,横丫肠,fightim,2022-07-17 03:09:43,,1,30,超英式打鬥蠻過癮，雖然不知道他們爲什麽打。
1,1nL,207499963,2022-07-16 10:18:52,,2,20,这个进度，第三部可以打灭霸了…
1,淼淼Gardenia,cherrylo5dolly,2022-10-21 19:17:37,北京,0,30,不如第一部
1,洋葱骑士,155047175,2022-08-30 19:50:59,广东,0,20,第一部还挺好，这续集是个什么玩意！
1,kiki204629,kiki204629,2022-07-20 22:39:58,,0,30,武力值惊人。
1,z,137388838,2022-07-21 11:58:48,,1,10,不论是从画面还是打戏，这部片子无疑将某种特质发挥到了极致，但却大过了故事本身
1,李湘,leexiang,2022-07-31 13:45:10,,0,30,打斗场面不错，拳拳到肉，看得我肉痛。不过，特效和剧情有点不行。
1,东门,WANGYANHUI,2022-08-11 10:06:18,,0,20,韩国队长
1,ReMinD,49761291,2022-07-19 19:19:51,,0,20,因为看过一了知道是超能力人大乱斗 所以反而没有那种惊喜感了。 各种超能力让人感觉是x战警加其他漫威人物的各种技能缝合 故事也没有推进很多 失望。
1,杨三疯,y3f,2022-07-27 20:56:47,,0,30,纯纯的商业动作杀人奇幻血浆片，韩国在类型填补上也是可以了。
1,Peter,3607604,2022-07-17 03:30:00,,7,50,姗姗来迟，匆匆离场！多美啊！多美！
1,两仪·式,paladintyrion,2022-08-08 14:19:53,,0,20,第一部是惊喜，第二部快成惊吓了……金多美走个过场吗？？？
1,月千里,82501246,2022-08-12 19:56:51,,1,20,想不明白剧中人的操作，还有要强烈吐槽高丽棒子说的中国话
1,尔安宋🌈,xyhen,2022-08-15 23:09:40,,0,30,有点乱，最后大战有一出是致敬x战警3的凤凰吗。不过还是有点期待这个系列的
1,luoyinluoxuan,zxuanzi,2022-07-20 22:32:37,,0,20,为撒大热的影片续集总是拍不好！打斗戏只剩炫酷了！
1,離家行動,cecilia_kim,2022-07-17 15:55:17,,0,10,一集美剧能说清的量…
1,17,Kooie,2022-07-20 17:09:52,,0,30,这波是真当自个在拍超英是吧
1,康斯坦丁1900,54487178,2022-07-19 22:02:53,,0,30,节奏太慢了，前面铺垫太多了
1,melvins,melvins,2022-07-16 00:11:06,,1,40,奇幻
1,宫城佑佐,xiaoyoudouban,2022-07-20 23:17:39,,0,20,#5.8/10#魔女主线太弱，情感描写太俗。以至于姐弟两暴毙没有一点点共情，完全没有第1部魔女生活的代入感，可能人设需要，这部魔女全程一个表情，经历过悲欢离合后心智居然没有任何成长。另外打斗戏更多突出特效层面的场景破坏和追求眼花缭乱的极致速度，也少了第一部拳拳到肉的打斗设计，比较可惜。
1,咸鱼撵死猫,S.Q.X,2022-07-15 20:59:10,,0,30,要整个超人类宇宙啊
1,pinkmark,rainbow225,2022-07-15 20:55:23,,0,30,木有感情，全是特效！但还是会看第三部
1,失忆名侦探,xuyq,2022-07-27 05:29:29,,0,10,废话对白塑造不起角色，再说即便塑造起了一群没有剧情意义的炮灰角色又有什么用？
1,Merov Mugatu!,merovingianeven,2022-07-30 13:14:36,,0,20,这一部应该走搞笑路线的，魔女2号，鬼佬和Chief二人组都有这个潜质，可惜后面杀疯了
1,第七大陸,Wz12118,2022-07-18 21:38:33,,0,20,说着蹩脚中文的傻冒们被韩国怪物虐杀，呵呵…
1,潘洛斯,zhujianzhe,2022-07-17 23:47:14,,2,30,魔女笑起来居然很好看
1,Jasmine,parislover,2022-07-23 01:38:53,,0,30,又乱又长，所有角色的起源和故事都没说明白，而且除了第一部女主，这一部一个人的名字都不知道/不记得。普通话小队真是听得头大；英语小分队的日常斗嘴还挺有趣的，大胡子是gay的设定，能在韩国主流银幕上看到是件好事啊，而且俩人有很强的没头脑和不高兴化学反应；凡人姐弟也让人唏嘘，女主能力过于强，但展现得太少，就期待个第三部吧。
1,华盛顿樱桃树,49213881,2022-07-18 16:50:27,,0,30,有点雷同，剧情有点扯，有点太神乎其神，人设要是有点软肋会更好。
1,婴儿葛葛,romanbaby,2022-08-13 01:43:34,,0,30,比起几条在电影和电视剧节奏间反复横跳的叙事线，这戏最让人讨厌的是那几个爱装逼，中文不会说还要硬说的小bi崽子，可能导演也是这么想的，这样后面被搞挂掉，观众会看得比较爽吧。
1,阿飞日记,231220176,2022-09-15 20:45:22,新疆,0,30, 到处都是血浆会变得很廉价，不要以上来就让我看满地的尸体，他们是则么死的，我不要看尸体我要看他们是怎么死的。简直就是氪星人大战超人而且打不死，根本不是一个级别的，妹妹很漂亮，姐姐很潇洒，妈妈很牛逼能生出来这两个魔女。
1,Mura,gstone1723,2022-11-03 15:40:02,甘肃,0,30,比第一部无聊多了。。。
